<?xml version="1.0" encoding="UTF-8"?>
<acl xmlns="http://zf4.biz/zendacl"
 xmlns:xsi="http://www.w3.org/2001/XMLSchema-instance"
 xsi:schemaLocation="http://zf4.biz/zendacl ../../../../../../../src/chippyash/Zend/Acl/Xml/xsd/zendacl.xsd">
    <roles>
        <role type="GenericRole">guest</role>
        <role parents="guest" type="chippyash\Test\Zend\Acl\Xml\Stubs\TestRoleStub">user</role>
        <role parents="user">admin</role>
        <role parents="user,admin">superadmin</role>
    </roles>
    <resources>
        <resource>login</resource>
        <resource type="chippyash\Test\Zend\Acl\Xml\Stubs\TestResourceStub">logout</resource>
        <resource type="GenericResource">dashboard</resource>
        <resource parent="dashboard">edit</resource>
    </resources>
    <rules>
        <rule type="DENY"/>
        <rule type="ALLOW" roles="*" resources="login" assertion="chippyash\Test\Zend\Acl\Xml\Stubs\TestAssertionStub"/>
        <rule type="ALLOW" roles="user,superadmin">
            <privilege>GET</privilege>
            <privilege>POST</privilege>
        </rule>
    </rules>
</acl>